start	end	text
220000	221000	Section 12: e a difference. It’s not gonna change the reality of what I know. — Excerpt from the CBS 60 Minutes profile of Robert Bigelow One of the main driving forces in the creation of the AAWSAP was the legendary aerospace mogul Robert T. Bigelow who has put more private money into the study of UAPs and paranormal phenomena than anybody else in the world. Beginning in the 1960s, Bigelow worked to build an extended stay apartment business that began with a single
221000	222000	Section 12: ger aerospace corporations costing hundreds of millions or billions of dollars. Costing NASA less than $18 million, “NASA got to test this novel expandable technology for pennies on the dollar,” in the words of then NASA Deputy Administrator Lori Garver. Within less than two years of operation on the ISS, NASA was so enamored with the BEAM spacecraft that it granted a “BEAM Life Extension” contract to Bigelow for multiple additional years on Tranquility Node 3 on ISS.
222000	223000	Section 12: low’s business acumen foresaw that the NASA TransHab program shuttered by Congress was a timely opportunity to license and develop this novel expandable technology in the private sector and truly make a difference to the United States Space Program. Bigelow quickly licensed the TransHab technology and set about accelerating and optimizing the development of expandable habitats. He purchased a 50-acre parcel in North Las Vegas and almost overnight multiple large bu
223000	224000	Section 14: fed members of the group on the history of the ranch and on some of the incidents that had happened on the infamous Utah property. At the time of the dinner the BAASS group had already begun making investigative trips to Skinwalker Ranch and the area around it, and in fact most of those present at the dinner had already visited the ranch. Kelleher provided details on the recent research and investigative data gathered in and around the ranch, which left
224000	225000	Section 14: ican cases. Witt had also brought some equipment with her. She outlined her intent to the walk as much of the property as possible, both during daylight and at night. At 8:30 the following morning, Bigelow, Kelleher, and Witt climbed into Bigelow’s luxurious Challenger private jet at McCarran Airport (now Harry Reid International Airport), an
225000	226000	Section 14: rt), and within seconds the gleaming jet was taxiing to takeoff. It was the fastest and easiest way to get to Skinwalker Ranch and the beautiful, liminal world of the Utah badlands. In less than an hour the jet landed at Vernal Airport, where a white SUV waited to take the trio to the ranch. The airport staff at Vernal Airport did their best to hide their fascination with the legendary aerospace billionaire who regularly touched down at the airport an
226000	227000	Section 14: the extensive interviews that he and his team had already conducted with F/A-18 Hornet pilots, Aegis radar operators, and other eyewitnesses on the Nimitz case. As a part of the briefing, he also showed the now infamous Advanced Targeting Forward Looking Infrared (ATFLIR) imagery of the Tic Tac object. When the subject turned to the Skinwalker Ranch, the group realized that Elizondo and Witt had not yet visited the Skinwalker Ranch and needed to do so. Without hesitatio
227000	228000	Section 14: xelrod himself, had visited Skinwalker Ranch and were already experiencing some ranch-aftermath high strangeness events in their homes. Further down the dinner table sat Luis Elizondo, who worked collaboratively with Axelrod and was at the office of the Under Secretary of Defense for Intelligence (USDI). Elizondo looked dapper with jet black hair and
228000	229000	Section 15: es down. Buck and Roger suspected that the horses’ behavior might be linked to the unusual light that night. The AAWSAP BAASS program managers heard about the high strangeness activity on the Lagol property through MUFON Project Manager Richard Lang. AAWSAP and MUFON (Mutual UFO Network) had developed a collaborative arrangement and their relationship evolved into a highly efficient enterprise with open line communications and a very productive working alliance. Si
229000	230000	Section 15: he AAWSAP BAASS equipment also experienced several battery drainage and equipment failures on the Lagol property. For example, while attempting to capture in situ soil analysis data with a portable Thermo Fisher Niton X-Ray Florescence analytical instrument that is capable of recording the quantitative elemental composition of soil—for Mo, Zr, Sr, U, Rb, Th, Pb, Se, As, Hg, Au, Zn, W, Cu, Ni, Co, Fe, Mn, Cr, V, Ti, Sc, Ca, K, Ba, Cs, Te, Sb, Sn, Cd, A
230000	231000	Section 15: ny HDR SR10 camcorder was deployed in record mode, and each time prior to the night watch the investigators verified that the camcorder was recording. Then on July 27 at 9:00 p.m. “Investigator One” noticed the camcorder was not functioning in the record mode. An operational check was conducted, and Investigator One alerted his colleagues that th
231000	232000	Section 15: t 9:00 p.m. “Investigator One” noticed the camcorder was not functioning in the record mode. An operational check was conducted, and Investigator One alerted his colleagues that the camera had been manually switched from Record Mode to Demonstration Mode. The only way for this to happen was for someone to physically switch the setting, and Investigator One had been standing within 30 feet of the camera the entire time. As he examined the device for
232000	233000	Section 15: visit. So on July 13, an AAWSAP BAASS team comprised of three investigators with law enforcement experience was deployed on a preliminary fact gathering site visit from Las Vegas to the Scarsdale property. The team spent most of the day walking, photographing, and mapping the 20-acre property. Over the next two days the team recorded separate int
233000	234000	Section 17: arances. Author Jim Schnabel, in his engaging history of American psychic spies,8 recounts the bizarre series of events that unfolded at the lab when scientists began to “measure” Uri Geller’s alleged psychic abilities. Writes Schnabel: “Peter Crane who was a team leader at LLNL, a PhD scientist with TS SCI clearances and some of the others in the Livermore group quickly found themselves involved in more strangeness than they could handle. In the days
234000	235000	Section 17: ght. Aerial photos of his house were sent to his mobile phone from unknown numbers. And his pet dog once disappeared (through multiple locked doors) while Eddie slept, only to be found in the morning whimpering outside. Could Lacatski have transmitted “something” to Susanna Ash who subsequently passed it to her brother? Axelrods and the Infectious Agent Model To tease additional details out of the widespread pattern of “people bringing something home
235000	236000	Section 17: izarre events began to unfold both in the lab itself and at the homes of the scientists who were conducting the studies. As with the Skinwalker Ranch, many of the researchers involved had high level security clearances. Author Jim Schnabel, in his engaging history of American psychic spies,8 recounts the bizarre series of events that unfolded at the lab when scientists began to “measure” Uri Geller’s alleged psychic abilities. Writes Schnabel: “Peter Cran
236000	237000	Section 17: re being eventually diagnosed with Hashimoto’s Thyroiditis, an autoimmune disease in which the immune system attacks the thyroid gland. The Axelrod family also suffered health effects with the wife suffering flare-ups of Systemic Lupus Erythematosus (Lupus) and Raynaud’s Disease. Both Axelrod teenagers also suffered intense flu-like symptoms at different times following anomalies in their home, with the most serious medical symptoms occurring in the younger teenage
237000	238000	Section 18: asleep at the wheel, that the mixture of bureaucratic fear, careerism, and scientific conservativism at the Pentagon was handcuffing the ability of the United States to make progress in exploiting UAP-based technology. In Reid’s mind there was a grave danger that China and Russia, who were not similarly handcuffed, would succeed in taking quantum leaps forward from exploiting UAP-based hardware and thus gain an irreversible technological uppe
238000	239000	Section 18: red that the letter had been photocopied by unknown parties and copies given to people at the Pentagon, at the Under Secretary of Defense for Intelligence (USDI), and at DIA. The widespread distribution of Senator Reid’s once secret letter caused controversy. Among the surprised recipients of the letter was then Under Secretary of Defense fo
239000	240000	Section 19: ases all nuggets of information focusing on the theoretical and applied physics of UAP activity and performance. They detailed the twelve primary areas of UAP research interest, which includes Lift, Propulsion, Control, Power Generation, Materials, and Configuration/Structure. It was obvious from the questions from the AFOSI-PJ Director of Operations and his colleagues that the link between BAASS programs and AFOSI-PJ remained elusive. Then 45 minutes
240000	241000	Section 19: implications for national security. Angelo and his group listened politely and promised to see what they could do. However, as the meeting broke up, the central cautionary tale was that BAASS needed to be read into some Special Access Programs in order to progress much further in a relationship with AFOSI-PJ. This ground-breaking meeting was only the first of a series of initiatives that BAASS undertook in order to establish a working relationship with AFOSI.
241000	242000	Section 19: s, analysts, and investigators. When Angelo asked about BAASS security, Grossmann briefed him on the facility’s clearance, which was certified by the DSS; on the BAASS building communications, which were certified by the National Security Agency; and on the disposition of the security clearances for all 50 plus BAASS personnel. Grossmann described the constant presence of armed security guards at all BAASS facilities, including the constant presence of security
242000	243000	Section 19: ther members of his team, AFOSI special agents who maintained a politely skeptical air throughout the briefing. Angelo was briefed on the BAASS organization and its more than 50 researchers, analysts, and investigators. When Angelo asked about BAASS security, Grossmann briefed him on the facility’s clearance, which was certified by the DSS; on the BAASS building communications, which were certified by the National Security Agency; and on the dispo
243000	244000	Section 1: SkinWalkers-interior-for_Epub Defense Office of Prepublication and Security Review CLEARED for Public Release The views expressed in this publication are those of the authors and do not necessarily reflect the official policy or position of the Department of Defense or the U.S. Government. The public
244000	245000	Section 20: floating house” with very bright internal lights flying at a low altitude from northeast and moving southwest. The object was two to three stories high and was the length of a football field. He immediately drove to the Highland Police Department and reported the sighting. The dispatcher from Highland contacted the Lebanon Police Department to look out for the object. At about 4:10 a.m., Ed Barton, a police officer from Lebanon, responded to the dispatch from Hi
245000	246000	Section 20: of a football field. He immediately drove to the Highland Police Department and reported the sighting. The dispatcher from Highland contacted the Lebanon Police Department to look out for the object. At about 4:10 a.m., Ed Barton, a police officer from Lebanon, responded to the dispatch from Highland, and reported seeing a low flying, “massive, elongated triangle” that emitted rays of intense white light all around. The object came to within a t
246000	247000	Section 22: alker Ranch, contacted the security guard force, and took several RF readings over the next 24 hours. No RF signals of questionable origin were noted. During the late morning and early afternoon, they used an ORION, Non-Linear Junction Detector on the interior of the double-wide command and control center, but no clandestine electronic items were found. Their counterintelligence surveillance analysis of Skinwalker Ranch as well as the surrounding towns Fort Du
247000	248000	Section 22: either climbing the barbed wire fence or jumping over the wire. BAASS also obtained a variety of hair samples in the vicinity of these tracks. These hair samples were subjected to DNA analysis with inconclusive results. Skinwalker Ranch Research For the duration of the AAWSAP contract, BAASS compiled a large database of more than 200 separate reports of anomalies that were documented by the teams of BAASS security officers who were on the property 24 hours a day, s
248000	249000	Section 23: be explained, signal that was not detected on multiple previous readings. The first signal was 1210, 1213 and 1216 MHz and the second large spike was 1232.5, 1235.5 and 1238.5 MHz. These signals fell in the frequency bands of 1164-1215 and 1215-1240 MHz, which are allocated for Earth exploration-satellite (active), radio location G56, radio naviga
249000	250000	Section 24: for at least five years. Kelleher wondered if it was complete coincidence that the two unrelated incidents, in Virginia and in Utah, had occurred almost immediately following Lacatski’s meeting with DHS in Washington, D.C. Had the meeting created a “disturbance in the force”? The other hypothesis, of course, was that the incidents were entirely unrelated.
250000	251000	Section 25: he roof of the DHS. A secondary goal of the meeting was to explore how the advanced technology that lay at the heart of the BAASS program could be developed within DHS, thus potentially making this briefing a “win-win.” When Tara O’Toole and her entourage swept into the room, pleasantries and small talk were in short supply. Turning to Jim Bell, she asked, “Why are we here?” When Bell began the briefing with a jargon-laden summary of the propose
251000	252000	Section 25: Lacatski and the BAASS trio approached the security check point, Bell spotted them and walked quickly over to speed up their sign-in process. Bigelow, Lacatski, and Kelleher had met Bell a couple of months earlier at the Hyatt Regency Washington on Capitol Hill, when during dessert he had confided some war stories about his tours in Mogadishu, Somalia. With his jet-black hair and sallow skin, Bell displayed an aggressively cool demeanor. But today Kelleher coul
252000	253000	Section 26: were actually those of AAWSAP and, in fact, many of those details themselves were in error. The absence of ridicule by the news media caught the attention of members of Congress. Within weeks, senior staff members of the Senate Armed Services and Intelligence Committees were requesting briefings. Closed-door briefings were arranged. Navy pilots told longtime congressional staffers about the impossible craft they had encountered. Elected members of Congress h
253000	254000	Section 27: ases in the AAWSAP BAASS Data Warehouse that described pathological effects as a result of UAP-human interactions. Thus, the data in the AAWSAP BAASS Data Warehouse are fully consistent with the main thrust of the AAWSAP Final Report that there is a correlation between UAP activity and threat to human well-being. It is crucially important to distinguish here between a threat to human health versus a threat to humans. The AAWSAP Threat Analysis Repor
254000	255000	Section 27: d outside DIA that argued AAWSAP should only focus on researching the technology of UAPs. At the inception of the program, the AAWSAP principals both in Las Vegas and in Washington, D.C., were aware that in previous in-depth investigations the witnesses of core UAP technology also frequently reported paranormal fallout as well as psychic effects. W
255000	256000	Section 27: e Pentagon’s Mysterious UFO program,” hundreds of thousands, if not millions, of words have been written about the once secret UAP investigation effort. But it was not the intent of the program, as originally proposed by Senators Reid, Inouye, and Stevens, to ever see the light of day. One of the purposes of this book is to correct the record. The book was collaboratively written by James T Lacatski, the DIA Program Manager and Contracting Officer Re
256000	257000	Section 27: to day responsibility for the execution of the AAWSAP contract. There are no more authoritative voices regarding what was real and what was not about this unique government program. The Logic of the Broad Scope of AAWSAP Research From its inception, the AAWSAP BAASS program intended to keep the scope of subjects for investigation as wide as possible with the understanding that narrowing the scope prematurely would result in a distorted dataset. The d
257000	258000	Section 28: essages from the ufonauts that warned against nuclear war and destruction of the environment, or dispensed spiritual advice to humans. Known as the “contactee” movement, people such as George Adamski, George Van Tassel, Orfeo Angelucci, and Truman Bethurum had become household names by the 1950s and 1960s and had attracted tens of thousands of followers into new, quasi-religious groups that preached a message of brotherly love from the “space brothers
258000	259000	Section 28: iles at Malmstrom Air Force base in Montana in 196730 as well as missiles located in the Soviet Union. During the 1960s and 1970s, UFOs flew with impunity over Loring AFB in Maine, Wurtsmith AFB in Michigan, Minot AFB in North Dakota,31 and Malmstrom AFB in Montana. These incursions appeared to catch the United States military’s early warning systems completely by surprise. Phase 4: The 1960s through 1980s were replete with reports from eyewitnesses
259000	260000	Section 32: figurations. • Expand in-house photographic analysis capabilities (including, but not limited to, Forward Looking Infra-Red (FLIR) analysis). • Obtain historical, recent cockpit recordings and ECM recordings from AFOSI, Air Force, Navy, Marine, NASIC archives and current chain of command. • Obtain records, reports, raw data, and threat analyses pertaining to (but not limited to): advanced aerospace vehicle tracking by any agency or armed service
260000	261000	Section 32: nue in these footsteps. AAWSAP BAASS successfully conducted efforts in all seven departments described. To fully embrace the broad data collection efforts started by the DIA program, we propose that a privately funded research program could start small but eventually grow into a large organization comprising seven departments. In each of the
261000	262000	Section 32: rs was an example of how private funding can lead to groundbreaking research. Likewise, Prince Hans Adam of Liechtenstein provided a stable pipeline of funding over decades for a variety of programs both in Europe and in North America. Therefore, what follows is an attempt to apply the “lessons learned” from the AAWSAP BAASS program in assisting those interested in forming a new program to continue in these footsteps. AAWSAP BAASS successfully conduc
262000	263000	Section 34: ty professor Frank Salisbury, with a foreword by famed UFO pioneer Dr. J. Allen Hynek. UFO sightings were the most obvious examples of what later emerged as a much broader range of unusual phenomena in the basin, and the Skinwalker Ranch property eventually became the focal point of multiple investigations. One credible eyewitness to unexplained phenomena on the ranch and throughout the basin was a veteran lawman named Pete Pickup. Pickup spent 26 years
263000	264000	Section 7: DIA wanted permission to visit Bob about a number of things, including being able to visit his property in Utah known as Skinwalker Ranch. I learned that the letter was written by a man from the DIA who was a physicist: Dr. Jim Lacatski. Neither of us wanted to meet in our offices, so Dr. Lacatski came to my home where he told me he was an expert in rockets. He explained that he knew how rockets got started, how they functioned currently, and what the
264000	265000	Section 7: e anymore.” When George reached out to me about his Area 51 story, I couldn’t help but think of the Sheahan family. I agreed to do some investigating on the matter and did a live interview with George from Washington, D.C. Since then, he and I have kept in touch swapping stories, and George has steadfastly reported on the subject. He is a co-author of this book. That exemplifies how George has earned a well-deserved reputation as a subject matt
265000	266000	Section 7: pinion. But you are not entitled to your own facts.” Through AAWSAP, we discovered that there weren’t tens, or hundreds, of people who have credibly witnessed UAPs, there have been thousands. The history of the UAP study Senators Stevens, Inouye, and I supported was largely unknown until one day a reporter called me from The New York Times. I was hesitant to talk about it. I had recently retired from the Senate, and there was still a stigma attached to
266000	267000	Section 9: left them. Silently, the three walked back to the Command and Control Center trailer, located on the east end of the ranch, for the debriefing. A couple of years later, AAWSAP BAASS program manager Kelleher interviewed Axelrod and Costigan separately about the events on the ranch that night. Both remained baffled regarding the source of the fe
267000	268000	Section 17: ial Susanna Ash, who was hired at DWO in January 2011 and sat in the office cubicle at DIA next to Lacatski between February and June 2011, reported that on the night of February 6, 2011, the night before Lacatski’s February 7 briefing to the DHS (see Chapter 16), Eddie Ash, Susanna’s brother who previously had no experience whatsoever with anomalies, ha
268000	269000	Section 26: ecade that followed, directly led to the release of the Unidentified Aerial Phenomena Task Force (UAPTF) Report by the Office of the Director of National Intelligence on June 25, 2021. This chapter tells that story. The catalyst for the ultimate public reveal of the Pentagon programs were the 2015 and 2016 reports by naval aviators of increasing encou
269000	270000	Section 8: ing with the publication of an article in TheNew York Times in December 2017, the world now knows that these denials were not factual. There were two remarkable things about AAWSAP. The first was that it existed at all. Between September 2008 and December 2010, the Pentagon spent those millions investigating UAPs as well as the paranormal and psychic correlates to UAPs. The second remarkable feature that has been secret until the publication of this boo
270000	271000	Section 12: ged that his long and successful business career was by and large inspired by his interest in the two central questions of human existence—are we alone in the universe and what happens when we die? National Institute for Discovery Science (NIDS) Bigelow created the National Institute for Discovery Science (NIDS) in 1995 with a two-fold mission: to research survival of consciousness after death and to research the UAP mystery. Within a year of the formati
271000	272000	Section 16: ght appeared in their home . . . shortly after the flying saucer sighting, it first appeared in the older sister’s bedroom, it went down the hall and appeared in my mother and dad’s bedroom . . . —Kim Arnold, daughter of Kenneth Arnold, relating the appearance of a ball of light/orb in the Arnold home shortly after her father’s history-making sighting on June 24, 19475 Within nine months after signing the contract with the DIA in September 2008, BAASS
272000	273000	Section 17: d brought “something” home from Skinwalker Ranch with them. The officers confirmed that they or their partners had experienced poltergeist and other paranormal activity in their homes following their tours on the ranch. James Lacatski experienced a profound anomaly on the ranch in 2007, which was a significant instigation for the formation of the AAWSAP BAASS program. Lacatski and his wife experienced a few, but not many, anomalies in their home in t
273000	274000	Section 17: ely serving intelligence agency personnel who visited the ranch during the AAWSAP BAASS program experienced profound anomalies while on the property. And even more importantly, all five brought something home with them. Jonathan Axelrod and his family are the “poster children” for the eruption of anomalies in the home following trips to Skinwalker Ranch (Chapter 1). For more than a dozen years following his July 2009 and subsequent trips to the ranch,
274000	275000	Section 18: er being circulated, a meeting was convened at the Pentagon, and in attendance were Lynn, Jones, Lettre, Clapper, Bob Carlsberg, who at time was a senior DWO official at Defense Intelligence Agency, as well as others. The biographies of the attendees at this pivotal meeting read like a Who’s Who of subsequent career success at DoD. By 2011 Lynn would retire from Do
275000	276000	Section 19: ficant numbers of the public. In the counterintelligence parlance, BAASS could function as an OPSEC sensor for AFOSI-PJ. After negotiating the heavy layers of security at AFOSI, Lacatski, Kelleher, and Grossmann met with Jack Angelo, who in December 2009 was the Director of Operations, Office of Special Projects, and two other members of his team, AFOSI special agents who maintained a politely skeptical air throughout the briefing. Angelo was brief
