start	end	text
54000	55000	Section 22: and six Tobacco Plants. See Appendix III for technical details of the plant experiments. A seed germination and growth experiment were set up at both BAASS Headquarters in Las Vegas and on Skinwalker Ranch in 2010. BAASS Chief Biologist Roger Whittiker set up the BAASS control experiment, while BAASS Biologist Amanda Kruse set up the experiment in the Bigelow Ranch Trailer, one in the living room and one in the bedroom. See Appendix III for technical details of the se
55000	56000	Section 3: SkinWalkers-interior-for_Epub-2 Skinwalkers at the Pentagon: An Insiders’ Account of the Government’s Secret UFO Program Copyright © 2021 by James Lacatski, Colm Kelleher, and George Knapp All rights reserved, including the right to reproduce this book or portions thereof in any form whatsoever. Cover: Pentagon: icholakov/iStock. Wolf eyes: sbelov/iStock Book design by Laura Smyth For in
56000	57000	Section 7: of Unidentified Aerial Phenomena. I commend Republican Senator Marco Rubio of Florida and Democratic Senator Mark Warner of Virginia for leading the Senate Intelligence Committee’s June 2020 authorization to create a UAP Task Force within the Pentagon. The task force was required to submit an intelligence assessment of the threat posed by UAPs and the progress the task force has made in understanding the threat to Congress and the U.S. public with
57000	58000	Section 21: ents in the Ministry of Defense in what was then the Soviet Union. When Knapp went to Russia in 1993 and 1996, he was introduced to several prominent scientists, ufologists, and high-ranking military members, including a Russian Air Force Colonel who was a member of the Soviet Thread III team. Prior to the AAWSAP report delivered to DIA, the documents that Knapp obtained had never been fully translated into English. The Thread III documents contain a very detail
58000	59000	Section 21: March 2010 Staff Sergeant Omar Gonzalez from Dakota Air Traffic Control (DATC) located at Ellsworth Air Force Base (EAFB) in South Dakota contacted BAASS to report that on March 3, 2010, he and his crew were working the Traffic Control section during the swing shift when their radar picked up unidentified traffic crossing a passing aircraft, call sign Columbia. The Columbia pilot responded saying that he had visual contact with the object. Gonzalez th
59000	60000	Section 26: started in Las Vegas in the early 1990s. Businessman Robert Bigelow’s decision to create NIDS in 1996 brought together many of the best minds to ever study the UFO mystery. The creation of NIDS and Bigelow’s purchase of Skinwalker Ranch caught the attention of Senator Harry Reid, who, more than a decade later as Senate Majority Leader, had the clout to secure funding for what became AAWSAP. Without Bigelow’s ownership of Skinwalker Ranch and the 2005 b
60000	61000	Section 10: y NASA and were being subjected to horrific biomedical experiments (injected with various deadly diseases) at facility in New Mexico. The lab had been cited for numerous violations of federal animal welfare regulations. Reporter George Knapp reached out to Reid about the chimps. Reid invited Knapp to come to Washington to record an interview. When Knapp and his photographer arrived in the Senate’s media room, Reid had a surprise. “Senator Reid figured out a
61000	62000	Section 13: Bigelow had hired Colm Kelleher, who rapidly transitioned from a biotechnology management position in San Francisco to recession hit Las Vegas. Kelleher was the first full-time BAASS employee, and his job title was BAASS Deputy Administrator (with Bigelow as CEO and Administrator). For Kelleher, this sudden transition from the world of medicinal chemistry dealing with the deadliest viruses on Earth, to an official, fully funded government program to tackle
62000	63000	Section 13: d on the Fed Biz Opps (FBO) website that invited aerospace and defense companies to compete for a five-year funding contract to study advanced aerospace threats. The FBO website is one of many standard vehicles where the United States Government agencies and Departments (NASA, DARPA, DoD, etc.) publishes RFPs. The DIA RFP was specific in that it requested that the study focus on 12 main areas of Advanced Aerospace performance: (1) Lift, (2) Propulsion, (3) Cont
63000	64000	Section 13: ning Office (DWO) at the Defense Intelligence Agency (DIA) as the architect of the program, thoughtfully named the Advanced Aerospace Weapon System Applications Program (AAWSAP) specifically because the program and the money was targeted to DWO at DIA. No other names for the program were either contemplated or discussed; this AAWSAP name was cr
64000	65000	Section 18: at DIA. The widespread distribution of Senator Reid’s once secret letter caused controversy. Among the surprised recipients of the letter was then Under Secretary of Defense for Intelligence General James R. Clapper and Susan Jones, who at that time was a senior official at the Special Programs Office at USDI. Within a few weeks of the letter being circulated, a meeting was convened at the Pentagon, and in attendance were Lynn, Jones, Lettre, Clap
65000	66000	Section 18: etter, Reid nominated his long-time senior staffer Robert (Bob) Herbert to be the official point of contact with DoD. Reid instructed Herbert to deliver the highly confidential letter to the Deputy Secretary of Defense, William Lynn. Herbert brought the letter to Lynn’s office and, following protocol, delivered the letter to Marcel Lettre, the Deputy Assistant Secretary of Defense for Legislative Affairs at the Pentagon. Sometime later, it transpir
66000	67000	Section 19: Lacatski, Kelleher, and BAASS Director of Investigations Larry Grossmann alternately blew into their hands and stomped their feet as they emerged from the car parked near the building that housed the Air Force Office of Special Investigations-Special Projects, also known as AFOSI-PJ. Grossmann and Kelleher had flown from Las Vegas the previous night, and the intent was to meet with a senior team of officials from AFOSI-PJ. Grossmann, now a senior BAASS inves
67000	68000	Section 21: 0 were enormously productive for the AAWSAP BAASS effort. The center of daily operations was far away from the bureaucratic machinations occurring in Washington, D.C. In Las Vegas, Nevada, the 50 strong team of BAASS analysts, investigators, scientists, and engineers were working full time on expanding the BAASS spheres of accomplishment. Details
68000	69000	Section 21: Aerial Phenomena Task Force (UAPTF) Report, Axelrod’s team had concluded twelve years prior to the UAPTF Report that the Tic Tac was not owned by the United States or by China or Russia. Since the Tic Tac investigation was initiated and executed by AAWSAP BAASS, Axelrod’s 13-page report was one of the 100 reports AAWSAP submitted to the Defens
69000	70000	Section 21: before the SCU report. Meanwhile the disciplined team comprising almost a dozen analysts and translators was busy culling thousands of separate UAP reports from France and other European countries, from Brazil and other South American countries, and from Russia, creating a very large data warehouse based on UAP performance. Each of the tens of thousands of cases entered into the AAWSAP BAASS Data Warehouse was initially painstakingly analyzed by the
70000	71000	Section 21: gth, were sent to the Defense Intelligence Agency (DIA) every 30 days. These reports summarized dozens of separate “boots on the ground” UAP investigations and progress on expanding investigative activities on and around Skinwalker Ranch. The subject of each monthly report is explained in Appendix I. BAASS-MUFON Collaboration In order for AAWSAP BAASS to best serve the government, it needed to become the central information source on UAPs in the United
71000	72000	Section 21: r Operation Plate. The investigation reportedly generated over 1,000 pages of documents, logs, sketches, and maps; over 500 photographs; and fifteen hours of motion film. Over the years, hundreds of pages documenting the Brazilian Air Force’s investigation have been leaked or have been officially distributed. As a part of the database project, AAWSAP maintained copies of the original Brazilian Portuguese materials and versions translated into English by in
72000	73000	Section 21: rsions into Northern Tier Air Force Nuclear Bases AAWSAP delivered multiple reports to DIA, including monthly reports, which detailed different levels of investigations into several historical incursions of UAPs into the Northern Tier nuclear missile bases during the 1970s. To fully appreciate the magnitude and scope of the incursions by UAPs into restricted airspace surrounding the nuclear weapons missile sites around the United States over a period
73000	74000	Section 26: ology founded by musician Tom DeLonge of Blink-182 and Angels and Airwaves fame. The main source for the Times article was Lue Elizondo, who had recently resigned from his Pentagon position and joined TTSA as Director of Global Security and Special Programs. The story included interviews with Senator Harry Reid, who had secured the $22 million dollars in funding for a DIA-supervised private contract, and with Robert Bigelow, whose subsidiary company BA
74000	75000	Section 34: -for_Epub-33 Appendix IV: Background on Skinwalker Ranch A picturesque, 480-acre ranch property in northeastern Utah’s Uintah Basin played a pivotal role in the creation of AAWSAP, BAASS, and—eventually—AATIP and the UAP Task Force. The property, now known worldwide by its nickname Skinwalker Ranch, is likely the most intensely studied UFO and paranormal hotspot in the world. Unidentified aerial phenomena have been reported in the skies of the Uin
75000	76000	Section 7: Advanced Aerospace Weapon System Applications Program (AAWSAP) was conceived. Senators Stevens, Inouye, and I decided to allocate $22 million to get the program started. A government request for proposal was put out, and Bob Bigelow’s company secured the bid. When I first reached out to my Senate colleagues on UAPs, I wanted to find out if there was anything to these sightings. New York Senator Daniel Patrick Moynihan once said, “You are entitled t
76000	77000	Section 7: erged the original AAWSAP program with the Pentagon’s Advanced Aerospace Threat Identification Program (AATIP), a program that also investigated UAPs but in the context of the U.S. military. Skinwalkers at the Pentagon: An Insiders’ Account of the Government’s Secret UFO Program provides a full picture of the purview of and accomplishments achieved by the AAWSAP program. Readers will be amazed, enthralled, and I hope that interest in studying UAPs
77000	78000	Section 13: DIA on the need to study the threat potential of technology of unknown origin in United States airspace, including UAPs. Suffice it say that in 2007 there were few men who could have accomplished what James T. Lacatski, Robert T. Bigelow, and Senator Harry Reid achieved. Once Bigelow had briefed his long-term friend Reid on the extraordinary history of UAPs at the Utah ranch, as well as on the recent astounding experience by a high-level Defense Intelli
78000	79000	Section 13: e structure. In addition, he began reaching out to several of the old NIDS Science Advisory Board members in order to solicit advice and input on quickly building an organization. By early November 2008 Bigelow had hired Colm Kelleher, who rapidly transitioned from a biotechnology management position in San Francisco to recession hit Las Vegas. Kelleher was the first full-time BAASS employee, and his job title was BAASS Deputy Administrator (with Big
79000	80000	Section 13: t in spite of the tens of thousands of newspaper articles, blog posts, and TV shows since the December 2017 article that first broke the Tic Tac case, nobody had yet focused on the foundational and fundamental roles that Doug Kurth and AAWSAP had played in making this extraordinary UAP case public knowledge. Back at DIA headquarters in Washington, D.C., Lacatski was the primary mover and shaker in fast tracking many of the BAASS infrastructure pro
80000	81000	Section 18: usehold name. The most senior DIA person attending the meeting was Bob Carlsberg. Within a year of the meeting, Carlsberg retired from the Department of Defense after serving as the Senior Intelligence Officer and acting Division Chief Defense Warning Office. By 2021 Carlsberg was affiliated with The Admiralty Trilogy, a family of simulations that focuses on Tactical Naval Warfare. Kelleher was told that the meeting began with the Honorable William Lynn uttering “Is
81000	82000	Section 19: ary 2010, Grossmann was on a plane from Las Vegas to Washington, D.C., for a clandestine meeting with Colonel Barry Hennessey. Now retired, Hennessey had previously been USAF Director of Security, Counterintelligence and Special Program Oversight at the Pentagon. Hennessey had also been one of Angelo’s predecessors as the Director of Special Projects at AFOSI-PJ, and his name was inextricably linked with many UAP cases during the 1980s and 1990s in which AFOSI w
82000	83000	Section 18: der President Obama as the Undersecretary of Defense for Intelligence and following that he became a Senior Vice President for National Security at Lockheed Martin Corporation. Within less than a year after the meeting, General Clapper would be appointed as the fourth U.S. Director of National Intelligence from August 2010 to January 2017, and following his retirement, his frequent and highly publicized tussles with President Donald Trump would make h
83000	84000	Section 8: rt, and with the concurrence of the DIA Directorate of Finance, wrote a small-business set-aside solicitation (HHM402-08-R-0211) using the then-new statement-of-objectives format. It was issued on August 18, 2008, on the Federal Business Opportunities (Fed Biz Opps) website, with a proposal due date of September 10, 2008. Twelve days later, a contract (HHM402-08-C-0072) was awarded to the sole bidder, Bigelow Aerospace Advanced Space Studies (BAASS), for an initial d
84000	85000	Section 10: ears earlier—but never acknowledged or even mentioned publicly—was finally revealed in a sensational, front-page story in The New York Times. The Times report described the program as a secretive military study of UFOs, Unidentified Flying Objects, aka flying saucers. According to the story, the name of the program was AATIP, an acronym for the Advanced Aerospace Threat Identification Program. AATIP was not the name of the program Reid initiated, but it is the na
85000	86000	Section 13: . There was no time to waste. The major challenge for the newly formed BAASS was to build the organizational structure as well as the security infrastructure for handling classified documents and communications devices. As Kelleher was doing this in Las Vegas, Lacatski faced the daunting task of accelerating the normal slow-moving government side at DWO. First Hire at BAASS: The Tic Tac Case Was Within weeks of landing in Las Vegas, Kelleher had b
86000	87000	Section 13: 15,000 ft and saw “a rather large disturbance in the ocean surface.” Kurth emphasized that “the seas were surprisingly calm that day with rolling swells but no surface waves.” Kelleher knew that this event, during which United States Navy Commander David Fravor had now famously seen and engaged with the unidentified object that later became known as the Tic Tac, could be an important case to investigate for the fledgling BAASS organization as a part of the AAWSAP
87000	88000	Section 14: come the most famous UAP event in history, was known to only a very few people at BAASS and some highly specialized military investigators led by Jonathan Axelrod. Also, by the time of the dinner, two of Axelrod’s team, Jim Costigan and David Wilson, as well as Axelrod himself, had visited Skinwalker Ranch and were already experiencing some ranch-aftermath high strangeness events in their homes. Further down the dinner table sat Luis Elizondo, who
88000	89000	Section 14: table sat Luis Elizondo, who worked collaboratively with Axelrod and was at the office of the Under Secretary of Defense for Intelligence (USDI). Elizondo looked dapper with jet black hair and was considered a brilliant Special Agent and analyst with a lot of expertise on counterintelligence investigations.Little did anyone at that dinner table realize that nine years later Lue Elizondo would become a media star and a household name in global UAP in
89000	90000	Section 14: uffs stood out and Russian Olives and sagebrush were scattered on the properties they drove past. Turning south, the SUV headed through the old garrison town of Fort Duchenne and the headquarters of the Ute reservation. Corrugated Quonset huts and small cinderblock dwellings dotted the small town. Once past the tribal police headquarters the SUV sped up again and within several minutes they were rolling down the dirt road into Skinwalker Ranch. Witt was
90000	91000	Section 15: d checked batteries drained abruptly. After multiple failed attempts to recharge the Niton instrument, the soil samples were eventually taken and brought back to Las Vegas for subsequent elemental analysis. Secondly, the Aaronia Spectran HF-60100 1MHz to 9.4GHz Handheld Spectrum Analyzer had previously been successfully used on multiple AAWSAP BAASS trips to different locations to obtain measurement of electric and magnetic fields. The HF-60100 spectrum
91000	92000	Section 17: TV, and digital media reports detailing the first COVID-19 index cases in Washington state, Wuhan, California, and New York, the concept of an index case for an infectious disease is now familiar to everyone. Just as the Wuhan Institute of Virology or the wet markets in China may have been the source of the COVID-19 outbreak, could Skinwalker Ranch be the source of an infectious agent? Utilizing this terminology, Axelrod was the index case who was firs
92000	93000	Section 18: eeting had broken up with the decision to “postpone” any probability of the AAWSAP BAASS program proceeding to Special Access Program Oversight Committee (SAPOC) consideration within DoD. However, the pressing need for a Special Access Program (SAP) for contract data exploitation was still determined to be necessary. But there was another consequence of the widespread distribution of Senate Majority Leader Harry Reid’s confidential letter. The low profile of
93000	94000	Section 19: y officers at Skinwalker Ranch, which was formally a BAASS property for the duration of the AAWSAP contract. Kelleher then gave a summary of the BAASS scientific division, which included deep expertise in Theoretical and Applied Physics; Electrical, Software and Mechanical Engineering; as well as PhD-level scientific expertise in the Life Sciences in both theoretical and experimental biochemistry, molecular & cell biology, genomics, immunology, and vir
94000	95000	Section 24: ake this meeting happen. Lacatski sat down at the conference table in the SCIF with the DHS’s Jim Bell and Sacha Mover and began the briefing with the history of AAWSAP and BAASS, including the role of Robert Bigelow and Senators Reid, Inouye, and Stevens. As Lacatski began describing in detailed technical terms the multiple UAP investigations conducted by BAASS under the AAWSAP rubric, the level of astonishment in the two DHS officials began to rise
95000	96000	Section 27: a thorough methodological description of the SVP and Vallee Classification Number, see Confrontations: A Scientist’s Search for Alien Contact.24) The foundational configuration of the database format was based upon the “Six Layer Model for Anomalous Phenomena” developed by Jacques Vallee and Eric Davis.2 This six-layer model encapsulated all of the potential characteristics of UAP events that can be studied. It includes: 1) The Physical Layer: those p
96000	97000	Section 28: 90s, authors such as Pulitzer Prize winning psychiatrist John Mack,32,33 New York artist Budd Hopkins,34 and Temple University historian David Jacobs35 published several books that electrified and terrified the public in North America and in Europe. These books documented the widespread kidnapping of frightened citizens from their homes or from their cars; they were then transported against their will to laboratory-like locations where invasive, pain
97000	98000	Section 28: denizens of UFOs and, in many cases, subjected to forcible, sometimes painful, and terrifying medical procedures while onboard the UFOs. Throughout the 1980s and 1990s, authors such as Pulitzer Prize winning psychiatrist John Mack,32,33 New York artist Budd Hopkins,34 and Temple University historian David Jacobs35 published several books that electrified and terrified the public in North America and in Europe. These books documented the widesprea
98000	99000	Section 30: al Puthoff, Jacques Vallee, Eric Davis, and John Schuessler contributed by advising both BAASS and DIA on designing the multiple projects that constituted AAWSAP. Dr. Vallee’s advice in designing the AAWSAP BAASS CAPELLA Data Warehouse was invaluable. The hard work of the 50 BAASS employees who worked under unusual secrecy in executing the AAWSAP contract is also acknowledged. From military counterintelligence professionals, retired police officers, p
99000	100000	Section 32: density of UAP sightings, one of which has been intensively researched for over two decades. The three areas include the Uinta Basin, Utah (not necessarily including Skinwalker ranch); Dulce, Northern New Mexico; and the San Luis Valley, Colorado. The proposed intent is to subject these sites to intensive study using strategy and tactics that have been successfully calibrated, iteratively improved, and deployed in one location in NE Utah. This includes
100000	101000	Section 32: e much of the analysis previously conducted by aerospace corporations is decades old, a re-analysis with more modern equipment and technology will be necessary under the auspices of the Advanced Technology Department. 5.Consciousness Department It is considered imperative to determine what can be learned, analyzed, and evaluated with regard to the putative consciousness connection between UAPs and humans. Decades of field research by AAWSAP BAASS, NIDS, and multi
101000	102000	Section 7: context of science was now. As the United States Senate Majority Leader, I decided to meet in a classified location in the United States Capitol with two key members of the appropriations process. The two members of the Appropriations Committee who controlled the dark money, the non-public money, were Republican Senator Ted Stevens of Alaska and Democratic Senator Dan Inouye of Hawaii. After explaining what I wanted, Senator Stevens recounted a story from when
102000	103000	Section 7: ed “Glowing Auras and ‘Black Money’: The Pentagon’s Mysterious U.F.O. Program.” It was a hit. I immediately started to get dozens of interview requests. Strangers in elevators and friends, including current members of U.S. Congress, thanked me for looking into UAPs. Within a few months, even my wife, Landra, turned to me and said, “you’re not looking so crazy after all.” The media and public interest haven’t let up since; a week doesn’t go by with
103000	104000	Section 7: nt to be pegged as seeing things. But the experience always nagged at him. Because of his prior experience, he told Senator Inouye and me that he was happy to secure funding to study UAPs and related phenomena. Thus, the Advanced Aerospace Weapon System Applications Program (AAWSAP) was conceived. Senators Stevens, Inouye, and I decided to allocate $22 million to get the program started. A government request for proposal was put out, and Bob Bigelow’s company secured t
104000	105000	Section 8: e, the scope of the AAWSAP investigations at DIA, which were run by Bigelow Aerospace Advanced Space Studies (BAASS), was much broader and delved deeply into the psychic and paranormal relationships to UAP interactions. As Appendix I in this book lays out in full detail, an enormous body of data concerning the psychic and paranormal connections to UAP interactions currently exists at the Defense Intelligence Agency. Shortly after the contract awar
105000	106000	Section 8: s Mysterious U.F.O. Program,” there has been a multi-year frenzy of speculation, misinformation, and confusion about the nature of the program. This book is written by the two program managers, Drs. James T. Lacatski and Colm A. Kelleher, who oversaw the day-to-day operations of the AAWSAP BAASS program and is an attempt to correct the record and present scientific data reinforcing the need to explore UAPs and related phenomena. George Knapp, who is arg
106000	107000	Section 12: and to Mars. Regardless, the success of the BEAM program is an enduring part of Robert Bigelow’s legacy and continues to be a superb demonstration of private sector contributions to the United States missions in space. Bigelow Institute for Consciousness Studies As described in detail in this book, beginning in 2008 Bigelow was also one of the main driving forces in the creation of AAWSAP BAASS that began in September 2008 and by the end of 2010 had di
107000	108000	Section 10: ed, and ridiculed? For elected officials—as for scientists and journalists—the UFO subject was and is inherently perilous, a considerable risk to one’s personal and professional credibility. How Harry Reid Became the UFO Senator Reid’s abiding interest in UFOs dates back at least three decades. The first public hint was revealed on November 10, 1989, in a live interview with a Las Vegas television station. KLAS TV, a CBS affiliate and Nevada’s first
